{
  "identity_locked": true,
  "profile_locked": true,
  "material_sufficient": true,
  "manual_audit_pass": true,
  "remaining_risks": [
    "남부 냉장센터의 정확한 지역, 거래처명, 입찰 기관명은 Phase0에서는 가명으로 잠정 사용하고 TR 진입 전 확정 필요",
    "냉장 인증과 콜드체인 입찰 자격의 세부 법적 조건은 TR 진입 전 추가 조사 필요",
    "PF 만기표, bank waiver, covenant 문구는 ARC-02 집필 전 구체화 필요",
    "IR Q&A, 신용등급 watch list, 공시 순서 디테일은 ARC-03 집필 전 구체화 필요",
    "capex schedule, 설비 vendor, 인증 lead time은 ARC-04 집필 전 구체화 필요",
    "생산권 term sheet, 우선협상권, 공급 조건은 ARC-05 집필 전 구체화 필요",
    "서문석을 악역화하거나 도윤을 착한 관리자화하는 drift 위험 — work_guard와 Phase0 자체 감리에서 매 arc 확인",
    "회귀 지식이 미래 예언처럼 보이면 no-fantasy lane이 무너진다 — proof는 항상 현재 자료 기반으로 제한"
  ]
}
