{
  "identity_locked": true,
  "profile_locked": true,
  "material_sufficient": true,
  "manual_audit_pass": true,
  "remaining_risks": [
    "Repo-level pre_new_pitch_readiness_gate.py still reports unrelated bootstrap representative-work path failures; this does not invalidate this Stage0 bundle but should be repaired or explicitly excepted before broad automation.",
    "Phase 0 must preserve clean acquisition legality: advisory exit, public bid, creditor approval, court schedule, or SPV separation.",
    "TR production must enforce at least two incident beats per block because one TR block is a downstream 2-6 episode bundle.",
    "Do-yoon must remain self-interested and efficiency-driven; no charity rescue drift.",
    "Domain details for insurance clauses, creditor procedure, port cold-storage priority, and certification transfer should be concrete or deliberately abstracted without fake specificity."
  ]
}
